{
  "schema_version": "codenoesis.repository-snapshot/v1",
  "semantic_hash": {
    "algorithm": "blake3-256",
    "value": "b673624a329f43fd84852bbdeefd66326a7fcb1c03fdb626e2de6bfedff11997"
  },
  "semantic": {
    "configuration": {
      "profile": "standard-local-s0",
      "schema_version": "codenoesis.configuration/v1",
      "semantic_hash": {
        "algorithm": "blake3-256",
        "value": "4811a917bebed264f49382d65825686ad5ca506ce39bc51385e547b0c7ced1c0"
      }
    },
    "evidence_lineage_version": "codenoesis.evidence-lineage/v1",
    "extractor_contract_version": "codenoesis.extraction/v1",
    "extractor_versions": [],
    "ontology_version": "codenoesis.ontology/none-v1",
    "pipeline_version": "codenoesis.pipeline/s0-v1",
    "repository": {
      "commit_oid": "6d4152a7787ac82eedf3f9fc5df408dfdf6e412f",
      "contract_version": "codenoesis.repository/v1",
      "identity": "urn:codenoesis:fixture:s0-one-file-v1",
      "identity_schema_version": "codenoesis.repository-identity/v1",
      "object_format": "sha1",
      "tree_oid": "892c4a33b5529ba6b6651fc26765957f11f7ba9e",
      "vcs": "git"
    }
  },
  "envelope": {
    "created_at": "2000-01-01T00:00:00Z",
    "job_id": null,
    "correlation_id": "s0-golden-a"
  }
}
